HotelName,Address,OriginalRentNight,Discount,AmountPayableNight,Rating,Facility,ReviewRating,RoomQuality,Location
OYO Flagship 84596 Hotel North Campus,"Civil Lines Tehsilnull, Delhi·       1.7 km",2545.0,72,699.0,2.4, Geyser  Power backup  AC  + 1 more,318,very good,Delhi
SPOT ON Hotel Silver Palace Dx,"Near RK ASHRAM METRO STATION, Pahar Ganj, Delhi·       5.0 km",3571.0,65,1250.0,3.5, Reception  Queen Sized Bed  TV  + 6 more,138,Good,Delhi
Super OYO Hotel City Castle,"Near Karol Bagh, Nai Walan, Delhi·       5.0 km",3964.0,69,1199.0,4.5, Elevator  Free Wifi  Geyser  + 5 more,3369,Excellent,Delhi
OYO Blue Diamond Near Jahangirpuri Metro Station,"Opp. Metro Pillar No. 102, Near Sai Baba Mandir, Adarsh Nagar, Delhi·       6.6 km",1824.0,68,572.0,4.0, Hair Dryer  Ticket tour assistance  Reception  + 19 more,1770,Very Good,Delhi
Flagship Royal Paradise Near Tdi Mall,"C 7 Kailash Park Moti Nagar, Delhi·       8.8 km",2438.0,76,576.0,3.3, Parking facility  Reception  Public washroom  + 14 more,279,very good,Delhi
OYO Flagship 27928 Hotel Vintage ,"Near RK Ashram Metro station, Delhi·       5.0 km",2911.0,65,999.0,3.1, AC  TV ,315,very good,Delhi
Super OYO Townhouse 057 Gujranwala Town Near Model Town Metro Station,"Tehsil, Delhi·       4.0 km",5664.0,68,1779.0,3.4, Private entrance  Reception  Free Wifi  + 16 more,21,very good,Delhi
Super OYO Townhouse 868 Dream Connect Near TDI Mall,"Wz-3 Opp Pillor No 322 Moti Nagar Delhi, Delhi·       8.8 km",4249.0,65,1487.0,3.2, Free Wifi  Power backup  Card payment  + 10 more,2058,very good,DelhiDelhi
OYO Hotel Sun City,"Near Karol Bagh, Channa Market, Delhi·       5.7 km",3482.0,71,999.0,4.0, Parking facility  Reception  Free Wifi  + 17 more,0,NEW,Delhi
OYO Flagship 811980 Hotel Rainbow,"Block A kewal park extension opposite metro pillar number 78 Azadpur Delhi 110033, Delhi·       5.5 km",1789.0,67,576.0,3.2, Parking facility  Reception  Free Wifi  + 19 more,787,very good,DelhiDelhi
Collection O Model Town Metro View Near Model Town Metro Station,"Near Model Town Metro Station, Delhi·       2.8 km",5091.0,65,1782.0,4.1, Reception  Free Wifi  Caretaker  + 14 more,3565,Very Good,Delhi
OYO Flagship 85202 International Guest House Near Jaffrabad Metro Station,"New Usmanpur, Delhi·       3.2 km",2627.0,67,846.0,2.8, Free Wifi  Geyser  Power backup  + 5 more,174,very good,Delhi
Flagship Hotel BR International,"Paharganj, Delhi·       5.0 km",3519.0,77,799.0,3.9, Private entrance  Reception  Power backup  + 26 more,602,Good,Delhi
OYO Flagship 80575 Kashish Residency Near Model Town Metro Station,"Ashok Vihar-3, Delhi·       3.9 km",2328.0,67,750.0,4.1, AC  TV  Attached bathroom ,1219,Very Good,Delhi
Flagship Hotel Vandana Inn,"Near New Delhi Railway Station, Delhi·       4.6 km",2845.0,71,799.0,3.2, AC  AC  TV  + 2 more,714,very good,DelhiDelhi
OYO Townhouse 511 Prakash continental Near Netaji Subhash Place Metro Station,"Netaji Subash Palace, Delhi·       6.4 km",5248.0,72,1437.0,2.3, Ticket tour assistance  Reception  Free Wifi  + 15 more,336,very good,Delhi
Flagship Roshan's Inn Near Dilshad Garden Metro Station,"Near Dilshad Garden Metro Station, Delhi·       6.5 km",2499.0,76,599.0,3.7, Elevator  Free Wifi  Geyser  + 4 more,916,Good,Delhi
Capital O Grand Central Near Gurudwara Shri Bangla Sahib,Near Karol Bagh metro station·       5.5 km,5252.0,80,999.0,3.3, Parking facility  Reception  Free Wifi  + 13 more,34,very good,
Flagship Rs Hotels Near M2k Cinemas Rohini,"Shiva Market, Delhi·       9.0 km",1925.0,67,620.0,2.4, AC  TV ,230,very good,Delhi
OYO Flagship 810642 Hotel KD Homes,"wazirabad near book shop opposite mohalla clinic Delhi, Delhi·       4.2 km",3519.0,77,799.0,2.6, AC  TV ,207,very good,DelhiDelhi
Collection O Hotel Ambience,"Near New Delhi Railway Station, Delhi·       5.3 km",4355.0,72,1199.0,3.1, Private entrance  Reception  Free Wifi  + 12 more,52,very good,DelhiDelhi
OYO Kl Khari Inn,"Near Ashok Park Main, Rampura Marg, Delhi·       6.7 km",2528.0,64,885.0,3.9, Parking facility  Reception  CCTV cameras  + 7 more,1037,Good,Delhi
OYO Flagship 80769 Seven Heaven ,"B-54 Lawrence Road Industrial Area Near Lawrence Road, Delhi·       7.0 km",2424.0,74,626.0,4.0, Parking facility  Free Wifi  Power backup  + 6 more,0,NEW,Delhi
Flagship King Stay Near Tdi Mall,"Block N, Delhi·       8.6 km",2809.0,67,905.0,3.4, Free Wifi  Geyser  Power backup  + 5 more,911,very good,Delhi
Super OYO Collection O Shalimar Bagh Near Haiderpur Metro Station,"Shalimar Village, Delhi·       7.6 km",4278.0,67,1378.0,3.4, AC  TV ,329,very good,Delhi
OYO Flagship 813361 Golden Petal,"Jheel Khurenja Geeta Colony, Delhi·       6.3 km",2075.0,65,726.0,2.6, Free Wifi  AC  TV ,28,very good,Delhi
Flagship Vikal Stay Near Gokulpuri Metro Station,"East Gokalpur Delhi Delhiindia110094, Delhi·       7.1 km",2825.0,64,989.0,3.6, Free Wifi  Geyser  Power backup  + 5 more,2779,Good,DelhiDelhiDelhi
Super OYO Townhouse 381 Dilshad Garden Near Dilshad Garden Metro Station,"Pocket E, Delhi·       9.9 km",4712.0,65,1649.0,4.0, Elevator  Geyser  Power backup  + 3 more,175,Very Good,Delhi
Flagship Hotel Happiness Inn Near Tdi Mall,"Karampura, Delhi·       7.7 km",3519.0,71,999.0,2.6, Elevator  Free Wifi  Geyser  + 8 more,264,very good,Delhi
SPOT ON 86927 Hotel Anchal DX ,"Paharganj Delhi, Delhi·       4.9 km",2644.0,62,999.0,3.7, Reception  Free Wifi  Caretaker  + 14 more,136,Good,DelhiDelhi
OYO Hotel Delhi Delight Near Sarai Rohilla Railway station,"Near Sarai Rohilla Railway Station, Delhi·       4.5 km",3505.0,71,999.0,3.6, Free Wifi  Geyser  Power backup  + 7 more,2509,Good,Delhi
OYO The Olive Inn,"Near Karol Bagh, Channa Market, Delhi·       5.8 km",7351.0,83,1199.0,4.3, AC  TV ,788,Very Good,Delhi
Flagship Hotel City Heart,"Paharganj , Delhi·       4.8 km",2817.0,64,999.0,3.4, AC  TV ,13,very good,Delhi
Flagship Hotel S Inn,"Paharganj New Delhi, Delhi·       5.0 km",4212.0,71,1199.0,4.3, Elevator  Free Wifi  Geyser  + 4 more,62,Very Good,DelhiDelhi
Meet You There Shakarpur,"Shakarpur Laxmi Nagar Metro, Delhi·       8.5 km",1953.0,67,638.0,3.8, Reception  Free Wifi  Caretaker  + 6 more,137,Good,Delhi
OYO Townhouse 1130 262 Kailash Enclave Near M2K Cinemas Rohini,"Harsh Vihar, Delhi·       9.0 km",4281.0,65,1498.0,2.6, Elevator  Free Wifi  Geyser  + 7 more,723,very good,Delhi
OYO Townhouse 286 Near Kohat Enclave Metro Station ,"Near Pitampura Metro Station, Delhi·       8.2 km",4771.0,65,1670.0,4.1, Parking facility  Elevator  Free Wifi  + 2 more,694,Very Good,Delhi
OYO Flagship 86216  Hotel Mini Stays,"Central Delhi, Delhi·       4.7 km",3872.0,65,1355.0,3.2, Reception  Free Wifi  Caretaker  + 15 more,743,very good,DelhiDelhi
OYO Flagship 80976 The Star View Near Akshardham,"Vijay Block metro pillar no.52 Near Nathu Sweets Laxmi Nagar Delhi, Delhi·       8.3 km",2669.0,69,816.0,2.2, Parking facility  Reception  Free Wifi  + 9 more,24,very good,DelhiDelhi
OYO 74753 Sushma Ssadan,"Sawan Park Ashok Vihar Phase 3 Model Town Tehsil, Delhi·       3.7 km",2667.0,65,933.0,2.8, Reception  Free Wifi  Caretaker  + 11 more,75,very good,Delhi
SPOT ON 811068 Ask Guest House,"West Babarpur, Delhi·       5.4 km",2448.0,67,788.0,3.2, AC  TV ,582,very good,Delhi
OYO Flagship 79578 I Stay,"Babli Chowk, Near Tooti Chowk, Mail Bazar, Paharganj·       5.0 km",2825.0,64,999.0,4.8, Elevator  Free Wifi  Geyser  + 7 more,0,Excellent,
OYO 74596 Dream Town Near V3S Mall,"Shahdara, Delhi·       7.2 km",3822.0,64,1338.0,4.0, Free Wifi  AC  TV  + 1 more,725,Very Good,Delhi
OYO Flagship 11352 Vandana Hotel Gurudwara Shri Bangla Sahib,"Near New Delhi Railway Station, Delhi·       4.6 km",1789.0,67,576.0,3.0, Doctor on call  Ticket tour assistance  Reception  + 14 more,10,very good,DelhiDelhi
OYO Townhouse 118 Gagan Vihar Near V3S Mall,"Near RG Stone hospital , Hargobind Enclave, Delhi·       8.6 km",5125.0,65,1794.0,3.3, Elevator  Free Wifi  Geyser  + 9 more,45,very good,Delhi
OYO Flagship 810461 Hotel Aditya INN,"main bazar paharganj, Delhi·       5.0 km",2825.0,71,799.0,3.4, Parking facility  Private entrance  Reception  + 10 more,84,very good,Delhi
Capital O Season Grand Near Pitampura metro station,Near Pitampura metro station·       8.5 km,3762.0,67,1212.0,2.9, Hair Dryer  Free Wifi  CCTV cameras  + 5 more,3038,very good,
OYO Hotel Grand Peepal,"Near Karol Bagh metro, WEA, Delhi·       5.4 km",4198.0,71,1199.0,3.7, Free Wifi  Geyser  Power backup  + 3 more,731,Good,Delhi
Hotel Dream Palace Laxmi Nagar ,"Near Laxmi Nagar Metro Station, Delhi·       8.4 km",3125.0,67,1006.0,3.2, Parking facility  Free Wifi  Power backup  + 15 more,606,very good,Delhi
OYO Flagship 81042 Step Inn International,"Delhinull, Delhi·       4.6 km",3519.0,71,999.0,3.5, Free Wifi  Geyser  Power backup  + 3 more,61,Good,DelhiDelhi
Collection O 74329  Ajanta Hotel ,"Near leela ambience, Vishwas Nagar, Delhi·       8.0 km",5185.0,65,1815.0,3.9, Reception  Free Wifi  Power backup  + 15 more,62,Good,Delhi
Collection O Ramji 7 Grand Near Tdi Mall,"Near Kirti Nagar Metro Station, Delhi·       8.6 km",3691.0,67,1189.0,3.8, Parking facility  Reception  Free Wifi  + 12 more,2309,Good,Delhi
OYO Townhouse 281 Harsh Vihar. Near M2K Cinemas Rohini,"Near Pitampura metro , Harsh Vihar, Delhi·       8.7 km",6242.0,65,2185.0,3.8, AC  TV ,668,Good,Delhi
Super OYO Hotel J P Inn Near Patel Nagar Metro Station ,"Near Patel Nagar Metro, Block 1, Delhi·       6.8 km",5095.0,65,1783.0,3.6, Free Wifi  CCTV cameras  TV  + 1 more,1425,Good,Delhi
OYO Hotel Crown Continental Near Sarai Rohilla Railway Station,"11005, Delhi·       4.3 km",3436.0,61,1307.0,3.9, Reception  Free Wifi  Power backup  + 15 more,177,Good,Delhi
OYO Townhouse 619 Hotel Church House Rohini Near Rohini Sector 18 Metro Station,"Above Axis Bank, Near JIMS, Sector 15, Rohini, Delhi·       9.9 km",5042.0,64,1765.0,4.1, Elevator  Free Wifi  Geyser  + 4 more,1046,Very Good,Delhi
OYO Flagship 812397 Hotel Delhi Empire Palace,"Arya Nagar, Delhi·       4.6 km",2965.0,64,1038.0,3.3, Parking facility  Free Wifi  Power backup  + 8 more,52,very good,Delhi
OYO Flagship 2064 Hotel The Spot,"New Delhi, Delhi·       5.0 km",3591.0,66,1199.0,3.9, Elevator  Reception  Free Wifi  + 5 more,850,Good,DelhiDelhi
"OYO TownHouse Super 16 Residency, Near Bangla Shahib Gurudwara","Delhi, Delhi·       6.7 km",3384.0,65,1184.0,2.9, Elevator  Free Wifi  Geyser  + 4 more,469,very good,DelhiDelhi
Collection O Metro View Ashok Vihar Near Shalimar Bagh Metro Station,"Pocket C 1, Delhi·       4.8 km",4771.0,65,1670.0,3.2, Free Wifi  Geyser  Power backup  + 6 more,53,very good,Delhi
OYO Flagship 811700 Hotel Iconiic Residency Inn,"Delhi, Delhi·       6.7 km",3384.0,65,1184.0,4.1, Doctor on call  Reception  Free Wifi  + 14 more,32,Very Good,DelhiDelhi
OYO Hotel Town ,Near Karol bagh metro station·       5.4 km,4162.0,63,1499.0,2.4, AC  TV ,37,very good,
OYO Hotel Crown Continental,"11005, Delhi·       4.3 km",3869.0,69,1199.0,3.2, Doctor on call  Reception  Security  + 12 more,17,very good,Delhi
OYO 80168 Green Villa,"Near KOSMOS Hospital, Anand Vihar, Delhi C-61 Above SBI Bank·       9.3 km",3414.0,67,1099.0,1.2, Free Wifi  Geyser  Power backup  + 6 more,0,very good,Delhi
OYO Flagship 80818 Hotel Metro Inn Near Gurudwara Shri Bangla Sahib,"Aram Bagh Paharganj Delhi, Delhi·       4.7 km",3887.0,65,1360.0,2.9, AC  TV ,246,very good,DelhiDelhi
OYO Flagship 77798 Hotel Sai Guest House,"Azadpur, Delhi·       5.5 km",2638.0,71,744.0,2.7, Reception  Free Wifi  Caretaker  + 14 more,88,very good,Delhi
OYO Flagship 811160 Hotel Silver Street,"Pahar Ganj, Delhi·       5.0 km",2798.0,57,1199.0,3.1, Elevator  Free Wifi  Geyser  + 4 more,22,very good,Delhi
OYO Flagship 66745 Le Orange,"8880-81, Gali Number 2, Multani Dhanda, Paharganj, New Delhi, Delhi - 110055·       4.6 km",3887.0,65,1360.0,3.4, Reception  Free Wifi  Power backup  + 10 more,56,very good,DelhiDelhi
Collection O Golden Key Near TDI Mall,"Near Rajdhani College, Delhi·       9.8 km",4194.0,65,1468.0,3.3, Elevator  Free Wifi  Geyser  + 4 more,0,very good,Delhi
OYO Flagship 81741 Hotel Naseeb Near Jama Masjid,"Paharganj, Delhi·       4.7 km",3887.0,65,1360.0,4.3, Doctor on call  Reception  Free Wifi  + 13 more,0,Very Good,Delhi
Flagship Sagar Deluxe,"Paharganj, Delhi·       4.5 km",4212.0,71,1199.0,4.0, AC  TV  Seating area ,0,NEW,Delhi
OYO Flagship 813379 Hotel Heritage Inn,"Paharganj Delhi , Delhi·       5.0 km",4475.0,65,1566.0,2.9, Elevator  Reception  Free Wifi  + 7 more,62,very good,DelhiDelhi
OYO Flagship 805147 Hotel Sona International Near Gurudwara Shri Bangla Sahib,"Paharganj (near Delhi Railway Station)null, Delhi·       4.9 km",3887.0,65,1360.0,3.1, Free Wifi  Geyser  Power backup  + 3 more,653,very good,DelhiDelhi
OYO Flagship 80919 Hotel Vinayaka Inn Near Gurudwara Shri Bangla Sahib,", Delhi·       4.6 km",3887.0,65,1360.0,2.7, Doctor on call  Ticket tour assistance  Reception  + 24 more,12,very good,Delhi
Capital O Hotel Sunberry,"New Delhi, Delhi·       8.7 km",5552.0,65,1943.0,1.0, Doctor on call  Ticket tour assistance  Reception  + 15 more,0,very good,DelhiDelhi
OYO Flagship 81563 Hotel M g h,"Paharganj , Delhi·       5.1 km",3887.0,65,1360.0,2.5, Parking facility  Reception  Free Wifi  + 11 more,0,very good,Delhi
OYO Hotel Emporio Near Jama Masjid,"Near Shela Cinema, DB Gupta Road, Delhi·       4.7 km",5049.0,65,1767.0,3.1, Living Room  Washing Machine  Balcony  + 37 more,193,very good,Delhi
OYO Flagship 35359 Hotel Victoria Dx,"Near New Delhi Railway Station, Delhi·       4.9 km",3994.0,65,1398.0,3.1, AC  TV ,112,very good,DelhiDelhi
OYO Flagship 81569 The Red Rose Inn,"India, Delhi·       5.0 km",3887.0,65,1360.0,1.0, Ticket tour assistance  Reception  Free Wifi  + 15 more,0,very good,Delhi
Collection O 813248  IP Grand Kakardooma,"Karkardooma, Delhi·       9.2 km",6242.0,65,2185.0,3.1, AC  TV ,43,very good,Delhi
Flagship 18618 Ocean Blue Residency Near V3S Mall," A-14 Pridarshni Vihar Laxminagar, Delhi·       7.6 km",4231.0,65,1481.0,4.0, Parking facility  Reception  Free Wifi  + 17 more,0,NEW,Delhi
Flagship Hotel Sliver International Suites Near Jama Masjid,"India Delhi Delhi India, Delhi·       3.1 km",,47,,2.5, Free Wifi  Geyser  Power backup  + 3 more,185,very good,DelhiDelhiDelhi
OYO Flagship 812357 Hotel Landmark Deluxe,"Karol Bagh, Delhi·       5.1 km",,47,,3.4, Elevator  Reception  Free Wifi  + 6 more,0,very good,Delhi
OYO Flagship 811671 Hotel Swagat Dx,"New Delhi, Delhi·       4.6 km",,47,,4.8, Reception  Free Wifi  Geyser  + 2 more,44,Excellent,DelhiDelhi
OYO Flagship 811723 Hotel Sai Ram,"Azadpur, Delhi·       5.2 km",,47,,4.1, Elevator  Free Wifi  Geyser  + 4 more,66,Very Good,Delhi
Flagship Hotel Happy Moments,"Near Divine Hospital, Delhi·       4.5 km",,47,,3.4, Elevator  Free Wifi  Geyser  + 4 more,13,very good,Delhi
Flagship Kashish Residency,"single storey, Delhi·       2.0 km",,47,,3.4, Free Wifi  Geyser  Power backup  + 3 more,199,very good,Delhi
OYO Flagship 812858 A.j Guest House,"Gate No-2, Delhi·       7.3 km",,47,,4.0, Doctor on call  Reception  Caretaker  + 25 more,0,NEW,Delhi
Collection O 23641 Hotel Cozy Vibes Stay,"Near Inderlok Metro Station, Anandnagar, Delhi·       5.7 km",,47,,4.3, Free Wifi  Geyser  Power backup  + 2 more,0,Very Good,Delhi
SPOT ON 812212 Country Residency,"Laxmi Nagar, Delhi·       8.6 km",,47,,3.7, Geyser  Power backup  AC  + 2 more,200,Good,Delhi
Flagship Sr Residency Near CCD,"Block B, Delhi·       9.7 km",,47,,3.8, Free Wifi  Geyser  Power backup  + 3 more,249,Good,Delhi
OYO Flagship 812039 Blue Diamond Inn,"delhi, Delhi·       7.6 km",,47,,3.5, AC  TV ,10,Good,delhiDelhi
OYO Townhouse 816 Diamond Tree near Model Town Metro Station,"Block A, Plot No 72, near Model Town Metro Station·       4.0 km",,47,,4.0, Reception  Power backup  Security  + 28 more,0,NEW,
OYO Flagship 812895 Hotel Cozy Hut,"khasra no 122/16/2 Ground floor  khasra no 122/16/2 Ground floor  Gali no 1 Sant nagar Burarinull, Delhi·       6.6 km",,47,,4.7, Free Wifi  Geyser  Power backup  + 3 more,118,Excellent,Delhi
OYO Flagship 812491 Hotel Siddhartha Guest House,"Seelampur, Delhi·       4.1 km",,47,,3.1, Free Wifi  Geyser  Power backup  + 2 more,11,very good,Delhi
OYO Hotel Blue Stone,"Near NSP Metro , Shingaipur, Delhi·       7.3 km",,47,,5.0, Parking facility  Free Wifi  Geyser  + 9 more,0,Fabulous,Delhi
OYO Flagship 83552 Anchal Guest House,"India, Delhi·       4.8 km",,47,,3.0, Geyser  Power backup  AC  + 2 more,45,very good,Delhi
Flagship Hansa Residency Near Akshardham,"Laxmi Nagar, Delhi·       8.3 km",,47,,3.0, Elevator  Free Wifi  Geyser  + 4 more,93,very good,Delhi
OYO Flagship 811574 Hotel Tushar Continental,"Delhi, Delhi·       4.9 km",,47,,3.7, Free Wifi  Geyser  Power backup  + 2 more,84,Good,DelhiDelhi
East Inn,bkk·       6.6 km,,47,,4.2, Parking facility  Reception  Free Wifi  + 14 more,0,Very Good,
OYO Flagship 811575 Hotel Le Cashew,"Paharganj  Paharganj, Delhi·       4.7 km",,47,,4.7, Geyser  Power backup  AC  + 2 more,0,Excellent,Delhi
Flagship Dream Inn Near Akshardham,"Near Mithila Appartment Chandra Vihar Patparganj Delhi-110091, Delhi·       9.9 km",,47,,3.5, Free Wifi  Geyser  Power backup  + 3 more,90,Good,DelhiDelhi
OYO Flagship 81175 Hotel Moon Stay,"New Delhi, Delhi·       8.3 km",,47,,3.4, Ticket tour assistance  Reception  Caretaker  + 22 more,117,very good,DelhiDelhi
OYO 81212 White House Residency Near Haiderpur Metro Station,"108,Street Number 3, Shalimar Bagh Village, New Delhi·       7.7 km",,47,,2.6, Elevator  Free Wifi  Geyser  + 4 more,0,very good,Delhi
Collection O P G International,"Near New Delhi Railway Station, Delhi·       5.0 km",,47,,3.8, Free Wifi  Geyser  Power backup  + 6 more,312,Good,DelhiDelhi
OYO Hotel Prince Near Haiderpur Metro Station,"Haiderpur Village, Delhi·       8.6 km",,47,,2.5, Elevator  Free Wifi  Caretaker  + 8 more,59,very good,Delhi
Flagship Green High Near Laxmi Nagar Metro Station,"NEAR FRUIT POWER, Laxmi Nagar Metro Station, Delhi·       8.2 km",,47,,3.7, Free Wifi  Geyser  Power backup  + 2 more,33,Good,Delhi
OYO Flagship 810701 Mayura Residency,"Maharam Mohalla, Delhi·       7.4 km",,47,,2.7, Elevator  Free Wifi  Geyser  + 3 more,551,very good,Delhi
OYO SP Rooms Near Jahangirpuri Metro Station,"H-21 Mahendra Park, Delhi·       6.8 km",,47,,3.3, Parking facility  Ticket tour assistance  Reception  + 18 more,76,very good,Delhi
OYO Flagship R K Residency Near Jhilmil Metro Station,"488/5a Mcd Primary School Dilshad Garden, Delhi·       9.0 km",,47,,2.5, Geyser  Power backup  AC  + 1 more,98,very good,Delhi
OYO The Chill Palace Near Haiderpur Metro Station,"North West Delhi, Delhi·       8.2 km",,47,,4.0, Reception  Free Wifi  Security  + 12 more,0,NEW,DelhiDelhi
OYO Flagship 92890 Hotel Kunj Inn,"Vivek Vihar , Shahdara, Delhi·       7.6 km",,47,,4.1, Free Wifi  Geyser  Power backup  + 3 more,887,Very Good,Delhi
OYO 811874 Hotel Maharaja,"Address- Shop No : 30-32-34 Old Market Main Bus Stand Timarpur Delhi 110054.  Opposite DTC Bus Stand, Delhi·       1.6 km",,47,,1.5, Reception  Free Wifi  Power backup  + 13 more,10,very good,DelhiDelhi
Flagship Hotel Signature Village,"Near KD Campus, Gali No. 6A, Gopalpur Village·       3.6 km",,47,,3.2, Free Wifi  Power backup  Card payment  + 11 more,56,very good,
OYO Hotel New Blue Umbrella,"Centrally Located, Near Naini Lake, Dhaka, Delhi·       2.9 km",,47,,3.3, AC  TV ,74,very good,Delhi
Flagship Leisurrestay,"I.P.Extension, Delhi·       6.4 km",,47,,2.8, Doctor on call  Reception  Designated smoking area  + 16 more,0,very good,Delhi
OYO Flagship 79243 Hotel Neelam Palace,"Paharganj, Delhi·       4.5 km",,47,,3.1, Free Wifi  Geyser  Power backup  + 3 more,15,very good,Delhi
Super OYO Flagship Trio Raj,"pahargunj, Delhi·       4.6 km",,47,,3.5, Free Wifi  Geyser  CCTV cameras  + 2 more,25,Good,Delhi
OYO Home Sam Villa Studio,"Sam Villa, Ground Floor, Kanlog·       1.3 km",5587.0,68,1769.0,4.3, Free Wifi  Geyser  Power backup  + 8 more,355,Very Good,
OYO Hotel Sai Stay Inn,"Near JCB Public School, Sector-3, Shimla·       2.6 km",6345.0,65,2221.0,4.5, Free Wifi  Balcony  Bedside Table / Desk  + 13 more,0,Excellent,Shimla
OYO Flagship 7670 Hotel Rashik Homestay,"Below Hill View Parking, Shimla·       0.9 km",5829.0,65,2040.0,3.6,"AC,TV",111,Good,Shimla
OYO Home Krishna Monal Delightful Stay,Totu·       5.2 km,5062.0,64,1772.0,4.5, Free Wifi  Geyser  Power backup  + 2 more,251,Excellent,
Super OYO Flagship 703889 Aston Shimla Hills,"Badhai Near Sankat Mochan Temple, Shimla·       3.2 km",8674.0,65,3036.0,5.0, Geyser  Power backup  AC  + 1 more,0,Fabulous,Shimla
Capital O Tourist Homes,"Below old barrier, near shimla view hotel, harinagar, shimla·       3.2 km",6895.0,65,2413.0,4.4, Ticket tour assistance  Reception  Free Wifi  + 16 more,47,Very Good,shimlashimla
OYO Flagship 811936 Wonder Valley,"Shimla(H.P.), Shimla·       3.3 km",5298.0,65,1854.0,3.5, Geyser  Power backup  Kitchen ,130,Good,ShimlaShimla
Flagship Kudrat Home Stay,near Sankat Mochan  new friends colony·       3.4 km,7311.0,65,2559.0,3.6, Free Wifi  Geyser  Power backup  + 2 more,17,Good,
OYO Flagship 813412 Sharma Home Stay,"CITY SHIMLA, Shimla·       8.0 km",5949.0,65,2082.0,4.0, Parking facility  Reception  Power backup  + 16 more,0,NEW,Shimla
OYO Moksh Villa,"Near Sankat Mochan Temple, Shimla·       3.4 km",8541.0,65,2989.0,3.0, Parking facility  Reception  Free Wifi  + 6 more,86,very good,Shimla
OYO 702486 High And Seek Hotel,"Shimla Chail Road, Mahili, Mehli·       6.9 km",6877.0,65,2407.0,3.7, Free Wifi  Geyser  TV  + 4 more,59,Good,Shimla
Super OYO 10692 Hotel Shubham,"Near Snow View Parking, Fingask Estate, Shimla·       0.7 km",6277.0,65,2197.0,4.3, AC  TV ,384,Very Good,Shimla
Flagship Hotel Apasara,"lift, Shimla·       0.2 km",4407.0,69,1334.0,3.2, Doctor on call  Ticket tour assistance  Reception  + 17 more,25,very good,Shimla
Flagship Hotel Shimla View,"N h 22 Near Ghorda Chowki, Below Old Barrier, Harinagar·       3.2 km",5062.0,64,1772.0,4.6, Reception  Ticket tour assistance  Caretaker  + 30 more,458,Excellent,
Flagship Hotel Yadgar,"Hotel Yadgar, Near kali badi mandir mall road·       0.7 km",7499.0,65,2625.0,3.7, Parking facility  Free Wifi  Geyser  + 5 more,313,Good,
OYO Home 78009 Avon Villa Kanlog,Near I s b t Shimla·       1.4 km,7152.0,65,2503.0,5.0, Ticket tour assistance  Reception  Caretaker  + 17 more,511,Fabulous,Shimla
Super OYO Hotel Karan,"Near Saraswati Paradise School, Housing Board Colony Sanjauli·       2.0 km",5457.0,65,1910.0,3.7, Free Wifi  Geyser  Power backup  + 4 more,79,Good,
OYO Flagship 812333 Sita Palace,"Mall road , Shimla·       0.6 km",8377.0,65,2932.0,3.0, Free Wifi  Geyser  Power backup  + 1 more,0,very good,Shimla
OYO HOME 81250D Abhiaak Regency,"India, Shimla·       2.9 km",5577.0,65,1952.0,4.5, Reception  Free Wifi  Power backup  + 12 more,0,Excellent,Shimla
OYO Flagship 7686 Rose Garden Standard Rooms,"Near Post Office, Anjuna, Goa ·       19.4 km",3688.0,72,1002.0,1.7, Parking facility  Private entrance  Reception  + 14 more,0,very good,Goa
OYO Roshan Villa Near Immaculate Conception Church,"Db Marg, Fontainhas (quater), Altinho·       8.8 km",5185.0,65,1815.0,4.3, Free Wifi  Geyser  Power backup  + 6 more,505,Very Good,
Flagship Clausil Inn Near Immaculate Conception Church,"Near Miramar Beach, Panjim, Goa·       10.6 km",6078.0,65,2127.0,4.9, Free Wifi  AC  TV  + 7 more,593,Fabulous,Goa
Flagship Dewa Goa Hotel Near Dabolim Airport,"Near Domino's, Dabolim, Goa·       14.0 km",5970.0,67,1929.0,3.6, Elevator  Free Wifi  Geyser  + 4 more,414,Good,Goa
Collection O 81020E Candolim Beach Resort,"Candolim, Goa·       14.9 km",7280.0,77,1670.0,1.5, Reception  Free Wifi  Power backup  + 13 more,0,very good,Goa
Super OYO Townhouse 256 Silver Palm Resort Near Candolim Beach,"Behind Solitude, Annawaddo·       15.6 km",11429.0,65,4000.0,4.3, Geyser  Power backup  AC  + 1 more,942,Very Good,
Super OYO Flagship Declassio By Goa's Pearl Near Aguada Fort,"Candolim, Goa·       12.8 km",4921.0,65,1722.0,4.3, Hair Dryer  Elevator  Free Wifi  + 8 more,328,Very Good,Goa
Collection O 76989 Immaculate Classic Inn,"Altinho, Goa·       8.4 km",6391.0,65,2237.0,4.0, Free Wifi  Geyser  Power backup  + 3 more,338,Very Good,Goa
Flagship Trivikram Krupa,"Calangute, Goa·       16.2 km",4368.0,69,1330.0,3.6, Geyser  Power backup  AC  + 2 more,84,Good,Goa
Super OYO Route 77 Near Calangute Beach,"Naika Wado, Calangute, Goa·       15.8 km",4945.0,64,1731.0,3.7, Geyser  Power backup  AC  + 2 more,318,Good,Goa
Collection O Hotel Joaquim Near Baga Beach,"Titos Lane 2, Saunta Vaddo·       17.8 km",5214.0,65,1825.0,3.8, Elevator  Free Wifi  Geyser  + 7 more,399,Good,
Capital O Paguer Resort,"Calangute, Bardez, North Goa·       16.4 km",4182.0,64,1464.0,3.2, Bedside Table / Desk  Full Sized Bed  Dress Hanger  + 25 more,72,very good,Goa
Flagship Neelratna,"Goa, Goa·       16.2 km",4853.0,68,1513.0,4.4, Reception  Free Wifi  Caretaker  + 9 more,310,Very Good,GoaGoa
Super OYO Corinthia Boutique Rooms Near Candolim Beach,"Bardez, Goa·       15.2 km",4954.0,65,1734.0,2.8, Free Wifi  Geyser  Power backup  + 3 more,60,very good,Goa
Collection O Adam Beachside Resort By Joaquim Near Baga Beach,"House no - 7/38B, Calangute, Survey No. 244/3B Sauta waddo, Bardez Goa·       17.9 km",6142.0,65,2150.0,3.7, Reception  Free Wifi  Power backup  + 12 more,189,Good,Goa
Flagship Savita Holiday Goa Near Calangute Beach,"Calangute, North Goa·       16.2 km",4368.0,69,1325.0,3.2, Hair Dryer  Parking facility  Reception  + 17 more,125,very good,Goa
Flagship Kams Coco De Parra,"Goa 403510, Goa·       16.8 km",4368.0,69,1329.0,4.4, Free Wifi  Geyser  Power backup  + 6 more,17,Very Good,GoaGoa
Flagship Pravin Holiday Homes,"Near St. Alex Church, Bardez, Goa·       16.1 km",4268.0,65,1494.0,3.5, Free Wifi  Geyser  Power backup  + 3 more,0,Good,Goa
